video_id,title,categoryId,thumbnail_link,description
3C66w5Z0ixs,I ASKED HER TO BE MY GIRLFRIEND...,22,https://i.ytimg.com/vi/3C66w5Z0ixs/default.jpg,"SUBSCRIBE to BRAWADIS ▶ http://bit.ly/SubscribeToBrawadisFOLLOW ME ON SOCIAL▶ Twitter: https://twitter.com/Brawadis▶ Instagram: https://www.instagram.com/brawadis/▶ Snapchat: brawadisHi! I’m Brandon Awadis and I like to make dope vlogs, pranks, reactions, challenges and basketball videos. Don’t forget to subscribe and come be a part of the BrawadSquad!"
M9Pmf9AB4Mo,Apex Legends | Stories from the Outlands – “The Endorsement”,20,https://i.ytimg.com/vi/M9Pmf9AB4Mo/default.jpg,"While running her own modding shop, Ramya Parekh (aka Rampart) built her rep in underground gauntlet circuits. But success has a way of making enemies. Good thing she knows how to use all those fancy weapons she’s upgraded…  Apex Legends™ is a free-to-play battle royale game where legendary characters battle for glory, fame, and fortune on the fringes of the Frontier. Play for free now on Xbox One, PS4, and Origin for PC. Learn more about Apex Legends Season 6 – Boosted: http://x.ea.com/64060 Check out our YouTube channel: http://x.ea.com/56710.Follow us on Twitter: https://twitter.com/playapex.Follow us on Instagram: https://www.instagram.com/playapex/.#MeetRampart #ApexSeason6 #ApexSeasonSix #ApexLegends"
J78aPJ3VyNs,I left youtube for a month and THIS is what happened.,24,https://i.ytimg.com/vi/J78aPJ3VyNs/default.jpg,I left youtube for a month and this is what happenedMY COFFEE COMPANY: https://twitter.com/TOTMCoffeeJoin the subreddit: https://www.reddit.com/r/jacksepticeye/MORE MEMES ► https://www.youtube.com/watch?v=wGdn6ldQTTg&list=PLMBYlcH3smRxmCZzsUyrxB0IyKSQAU0pPJacksepticeye's Funniest Home Videos: https://www.youtube.com/watch?v=VqfLcdpBasY&list=PLMBYlcH3smRxOk7Cp_V2ar3QDfvljWvSyEdited by: https://twitter.com/DaveDelirious►Twitter : https://twitter.com/Jack_Septic_Eye►Instagram: http://instagram.com/jacksepticeye
kXLn3HkpjaA,XXL 2020 Freshman Class Revealed - Official Announcement,10,https://i.ytimg.com/vi/kXLn3HkpjaA/default.jpg,"Subscribe to XXL → http://bit.ly/subscribe-xxl XXL presents the 2020 XXL Freshman Class featuring NLE Choppa, Polo G, Chika, Baby Keem, Mulatto, Jack Harlow, Rod Wave, Lil Tjay, Calboy, Fivio Foreign, Lil Keed and 10th Spot winner 24kGoldn. Visit the 2020 XXL Freshman Class website → https://www.xxlmag.com/freshman/Credits:Directed by @travissattenProduced by @ritemediagroupMagazine cover shot by Travis ShinnCover collage and lettering created by @rich_tuBeat for video produced by Jetsonmade, Neeko Baby and 1st Class#XXLFreshman #XXLFreshman #HipHop #XXLFreshmanClass #XXLFreshmanCoverGo here → http://www.xxlmag.com/XXL on Facebook → https://www.facebook.com/xxlmagXXL on Twitter → https://twitter.com/XXLXXL on Instagram → https://instagram.com/xxl/"
VIUo6yapDbc,Ultimate DIY Home Movie Theater for The LaBrant Family!,26,https://i.ytimg.com/vi/VIUo6yapDbc/default.jpg,"Transforming The LaBrant Family's empty white room into a dramatic custom home movie theater. A portion of this video was sponsored by NortonLifeLock. Time to help protect your home title with Norton 360 with LifeLock Ultimate Plus. #NoPryingEyes Go to https://bit.ly/3iio4um to learn more or visit http://www.facebook.com/LifeLock & http://www.youtube.com/LifeLock    + SUBSCRIBE to our channel!: http://bit.ly/mrkateyoutube+ FOLLOW us on Instagram!: http://www.instagram.com/mrkate and http://www.instagram.com/joeyzehr+ SUBSCRIBE to the LaBrant Fam's channel: https://www.youtube.com/channel/UC4-CH0epzZpD_ARhxCx6LaQWATCH The LaBrant Fam's Nursery Makeover Here: https://www.youtube.com/watch?v=ZhoRLt42AmsWATCH how this collab all started here: https://youtu.be/Xi_F4TKJE5Y#INTERIORDESIGN #HOMETHEATER #MAKEOVER #MRKATE #THELABRANTFAMPIN PICS FROM OUR BLOG!: https://mrkate.com/2020/08/11/ultimate-diy-home-movie-theater-for-the-labrant-family/_________________________Instagram: http://www.instagram.com/mrkate and http://www.instagram.com/joeyzehrTik Tok: @mrkate Snapchat: MrKateTwitter: http://www.twitter.com/mrkateFacebook: http://www.facebook.com/mrkatedotcomPinterest: http://www.pinterest.com/mrkate/Become a member for exclusive VLOGS, LIVE CHATS, EMOJIS, BADGES and DISCOUNT CODES: https://www.youtube.com/channel/UCDVPcEbVLQgLZX0Rt6jo34A/join  _________________________Shop the entire video!: Chaise Lounge: https://bit.ly/3kzL1vlSofa: https://bit.ly/3fNAMQrSideboard: https://bit.ly/33R36yT Wallpaper: https://bit.ly/2DWAdpWWoven Poufs: https://bit.ly/39muMwe Curtains: https://amzn.to/3fIUf4B Nesting Black Tables: https://amzn.to/3fNje70 Sconces (similar): https://amzn.to/3fFPTeE Popcorn Machine (similar): https://bit.ly/2PGUS47 Drink Table: https://bit.ly/3gXUj1G Throw Blanket: https://bit.ly/3gOgV4N Terracotta Pillow: https://bit.ly/3eSXiGZ Jam Velvet Pillows: https://amzn.to/3ktNlnD Burgundy Velvet Pillows: https://amzn.to/3aekTRE Taupe Velvet Pillows: https://amzn.to/3kzIW2b Movie Clap Board: https://amzn.to/33Q1mpA Ticket Shadow Box: https://amzn.to/2XPHijs Popcorn Bags: https://amzn.to/3iymKDN _________________________Creative Credit: Audio Tracks - Epidemic Sound: http://share.epidemicsound.com/rGjgCA Mr. Kate ProductionExecutive Producers: Kate Albrecht and Joey ZehrSupervising Producer: AJ TeslerProducer: Annie O'RourkeCamera: Marco BottiglieriArt Department: Leo Martinez, Gabriel Gonzalez, Kenny NogueiraPA: Amy PattersonEdited by: Vianne Robitaille"
w-aidBdvZo8,I Haven't Been Honest About My Injury.. Here's THE TRUTH,24,https://i.ytimg.com/vi/w-aidBdvZo8/default.jpg,"Subscribe To My Channel - https://www.youtube.com/subscription_center?add_user=professorlive?sub_confirmation=1Shop Globalhooper: https://globalhooper.comHuge thank first off to the Dr who did my surgery, Dr Mark M. Mikael M.D. Everything was perfectly executed top to bottom with the surgery and recovery monitoring.Dr Mark Mikael M.D. - ossburbank.comHuge thank you to Shelley and the staff up at Progressive Physical Therapy for getting me back walking! Progressive Physical Therapy - https://www.progressivept.net/locations/valencia/And huge thank you to my current gym Sports Rehab LA! Especially Dr. Pat and Al Reeser. Want to give a special thank you to my cousin as well for helping me through the process. Sincerely appreciate you all helping me through this tough journey!Sports Rehab LA - https://www.sportsrehabla.com/contact-usSpecial heart felt thank you to the #LiveFam for supporting heavy after finding out about the injury. I've been overwhelmed with prayers, well wishes and support. Love you guys!▼ Follow Me ▼ INSTAGRAM - https://www.instagram.com/TheProfessor/FACEBOOK - https://www.facebook.com/professorliveTikTok - https://vm.tiktok.com/oMPx5Q/Twitter - https://twitter.com/TheProfessorSubscribe To My Cousin Zack SF - https://www.youtube.com/channel/UCme2Kta8YIheiGzL0qWStrw?sub_confirmation=1This was edited by JayLyons Productions - Info@jaylyonsproductions.com"
uet14uf9NsE,OUR FIRST FAMILY INTRO!!,26,https://i.ytimg.com/vi/uet14uf9NsE/default.jpg,"Hi babygirls!  Thank you so much for watching and for supporting! I LOVE YOU!! ❤️❤️label printer from amazon - https://amzn.to/3kF2x1k———————————————————————————FOLLOW US! ❤️LES Instagram- https://www.instagram.com/lesdomakeup/ALEX Instagram - https://instagram.com/vlexgalindo?igs...LES Twitter- https://twitter.com/LEXXXLIEEEALEX Twitter - https://twitter.com/VLEXXXGALINDOSnapchat @lexxxlieee Facebook- https://www.facebook.com/Lesdomakeup1/———————————————————————————PO BOX 972657EL PASO, TX 79997———————————————————————————Business inquires only: lesdomakeup@revel-mgmt.com"
ua4QMFQATco,CGP Grey was WRONG,27,https://i.ytimg.com/vi/ua4QMFQATco/default.jpg,"‣ What Was TEKOI: https://www.youtube.com/watch?v=PCeMCwxayp0‣ TEKOI Commentary: https://www.youtube.com/watch?v=ufsYK3Eecw4‣  Old version of TEKOI: https://www.youtube.com/watch?v=MhgLasBFr6o## CrowdfundersBob Kunz, John Buchan, Nevin Spoljaric, Donal Botkin, BN-12, Chris Chapin, Richard Jenkins, Phil Gardner, Martin, Steven Grimm, سليمان العقل, David F Watson, Colin Millions, Saki Comandao, Ben Schwab, Jason Lewandowski, Marco Arment, Shantanu Raj, rictic, emptymachine, George Lin, Henry Ng, Thunda Plum, Awoo, David Tyler, Fuesu, iulus, Jordan Earls, Joshua Jamison, Nick Fish, Nick Gibson, Tyler Bryant, Zach Whittle, Oliver Steele, Kermit Norlund, Kevin Costello, Derek Bonner, Derek Jackson, Mikko , Orbit_Junkie, Ron Bowes, Tómas Árni Jónasson, Bryan McLemore, Alex Simonides, Felix Weis, Melvin Sowah, Christopher Mutchler, Giulio Bontadini, Paul Alom, Ryan Tripicchio, Scot Melville, Bear, chrysilis, David Palomares, Emil, Erik Parasiuk, Esteban Santana Santana, Freddi Hørlyck, John Rogers, Leon, Peter Lomax, Rhys Parry, ShiroiYami, Tristan Watts-Willis, Veronica Peshterianu, Dag Viggo Lokøen, John Lee, Maxime Zielony, Julien Dubois, Elizabeth Keathley, Nicholas Welna## MusicDavid Rees: http://www.davidreesmusic.com"
SnsPZj91R7E,SURPRISING MY DAD WITH HIS DREAM TRUCK!! | Louie's Life,24,https://i.ytimg.com/vi/SnsPZj91R7E/default.jpg,"Since I was little, i've had these goals for my self to give back to my parents. Both of them have made so many sacrifices for me and my sisters growing up. They have done everything possible to make sure we had a better life. Thanks to you guys, I am at a place where I am financially stable and can do these things for my parents that I always dreamed about. One of my many goals was to buy my dad a truck. It is something he's always wanted but has never been able to purchase. I saved up my money and made it happen! He had no idea or expected it at all. It was the perfect surprise!!———————————————————————————Watch my previous videos:-Charli and Dixie D’Amelio X Morphe 2 HONEST REVIEW!!:https://youtu.be/lrwahe7o0HE-GOING ON OMEGLE'S RESTRICTED SECTION!!:https://youtu.be/ztP49FpBhck-RACING with the LA SQUAD!!:https://youtu.be/gadNRUl3TcU———————————————————————————Social Media:Instagram: @louiecasttroTwitter: @louiecasttroSnapchat: thehamielouie———————————————————————————Business Email: louiecasttro@yahoo.com———————————————————————————LOVE YOU PERRAS!"
SsWHMAhshPQ,Ovi x Natanael Cano x Aleman x Big Soto - Vengo De Nada [Official Video],10,https://i.ytimg.com/vi/SsWHMAhshPQ/default.jpg,Vengo De Nada - Ovi x Natanael Cano x Aleman x Big SotoDirected by Lalo The GiantExecutive Producer Jimmy Humildehttp://Instagram.com/Ovi_Oficialhttp://Instagram.com/Natanael_Canohttp://Instagram.com/mxalemanmxhttp://Instagram.com/BigSotoriusSuscríbete: http://Rancho.lnk.to/RHYoutubeEscucha Vengo De Nada aquí:http://Rancho.lnk.to/VengoDeNada 🎶Paginas Oficiales De Rancho HumildeSpotify: http://Rancho.lnk.to/RHSpotifyInstagram: http://Rancho.lnk.to/InstagramFacebook: http://Rancho.lnk.to/RHFacebook🎧Spotify Playlists:➤ 💪Entre Acordeones: http://Rancho.lnk.to/SpotifyPlaylist1➤ 🚬 420 Smoke Me Out: http://Rancho.lnk.to/SpotifySMOYouTube Playlists 📢📢  | Corridos 2020Natanael Cano: http://Rancho.lnk.to/NCPlaylistLegado 7: http://Rancho.lnk.to/L7PlaylistFuerza Regida: http://Rancho.lnk.to/FRPlaylistEl De La Guitarra: http://Rancho.lnk.to/EdlgPlaylistGrupo Codiciado: http://Rancho.lnk.to/GCPlaylistLos Hijos De Garcia: http://Rancho.lnk.to/HdgPlaylistHerencia De Patrones: http://Rancho.lnk.to/HDPPlaylistJunior H: http://Rancho.lnk.to/JrHPlaylistArsenal Efectivo: http://Rancho.lnk.to/AEPlaylist🎥Corridos | En Vivo: http://Rancho.lnk.to/CorridosEnVivo🎥Corridos | Videos Musicales: http://Rancho.lnk.to/Corridos2020#VengoDeNada #Ovi #NatanaelCano #Aleman #BigSoto
49Z6Mv4_WCA,i don't know what im doing anymore,22,https://i.ytimg.com/vi/49Z6Mv4_WCA/default.jpg,ssend love to my sponsor; for a super Limited Time! Go to https://NordVPN.com/casey or use code CASEY to get 70% off a 3 year plan plus 1 additional month free. NORD also brings you security tools like NordPass password manager.  which is great.  if this is something you need you should do get it.  thanks for being. agood sponsor NOrd!!  https://NordPass.comMusic Taylor Galford; https://taylorgalford.bandcamp.com/and GurtyBeats.com https://soundcloud.com/gurtybeats
nt3VVyv5pxQ,Try Not To Laugh Challenge #51,22,https://i.ytimg.com/vi/nt3VVyv5pxQ/default.jpg,You know what time it is— time to try not to laugh!This video was shot with a very limited crew. All cast & crew followed all CDC and California COVID-19 precautions and filming guidelines.Punch that bell icon so you'll know when we add a new episode!SHOP THE SMOSH CLOTHING LINE: https://smosh.storeWatch Every Drive Thru Ever: https://youtu.be/vml4hskxqtEWatch Mystery Piñata Party Challenge: https://youtu.be/WseASWaLVkcWatch Olivia & Noah Haven’t Left Smosh - SmoshCast #74: https://youtu.be/4elY5bL1BvkSubscribe To Smosh Pit: https://smo.sh/Sub2SmoshPitFollow Us:Instagram: https://instagram.com/smoshTikTok: https://smo.sh/TikTokFacebook: https://facebook.com/smoshTwitter: https://twitter.com/smoshIan Hecox: https://www.instagram.com/ianhecox/Courtney Miller: https://www.instagram.com/co_mill/Shayne Topp: https://www.instagram.com/shaynetopp/Damien Haas: https://www.instagram.com/damienhaas/Tommy Bowe: https://www.instagram.com/tomeybones/Check Out Our Other Smosh Channels:Smosh: https://smo.sh/Sub2SmoshSmosh Games: https://smo.sh/Sub2SmoshGamesSmoshCast: https://smo.sh/Sub2SmoshCast
I6hswz4rIrU,Rainbow Six Siege: Operation Shadow Legacy Reveal Trailer | Ubisoft [NA],20,https://i.ytimg.com/vi/I6hswz4rIrU/default.jpg,"“Prepare. Execute. Vanish”Sam Fisher joins Team Rainbow! Watch the Operation Shadow Legacy full reveal during the NA-Mini Major Finals on twitch.tv/rainbow6 August 16.#R6SPlease SUBSCRIBE: http://bit.ly/UbisoftYouTubeChannel Visit our official channels to stay up to date with Rainbow Six Siege:https://rainbow6.ubisoft.com/https://www.facebook.com/rainbow6usa/https://www.instagram.com/rainbow6gam...https://twitter.com/Rainbow6Gamehttps://www.youtube.com/UbisoftNA Discover all our Rainbow Six products and exclusive items on the Ubisoft Store: https://ubi.li/DZNaP ABOUT RAINBOW SIX SIEGE:Rainbow Six Siege is an exciting, new approach to the first-person shooter experience that puts tactical combat and masterful destruction at the center of the action. Lead your team of unique, counter-terrorist Rainbow operators through tense and thrilling combat scenarios, and achieve victory through smart preparation and strategic improvisation. Rainbow Six Siege is available now on Xbox One, PlayStation® 4 and PC.   KEY FEATURES:   -THE RULES OF SIEGE: Five versus Five. Attack versus Defend. Infiltrate versus Fortify. Team-based strategy meets intense, tactical combat. -WORLD'S ELITE COUNTER-TERRORIST OPERATORS: Choose your Operator and wield their unique ability to breach or defend the objective as a part of an elite team. -DESTRUCTION AS A TOOL: Walls can be shattered; floors and ceilings can be breached. Mastering the tactical use of destruction is the key to victory. -CLOSE-QUARTERS COMBAT: With tight spaces shaping all combat arenas, tense encounters and up-close-and-personal firefights abound within every Siege.ABOUT UBISOFT:Ubisoft is a creator of worlds, committed to enriching players' lives with original and memorable gaming experiences. Our rich portfolio of world-renowned brands includes: Assassin’s Creed, Far Cry, For Honor, Just Dance, Watch Dogs, Tom Clancy’s video game series including Ghost Recon, Rainbow Six and The Division.  We are dedicated to delivering original and memorable gaming experiences across all popular platforms, including consoles, mobile phones, tablets and PCs. To learn more, please visit www.ubisoft.com. © 2020 Ubisoft Entertainment. All Rights Reserved. Ubisoft, and the Ubisoft logo are registered or unregistered trademarks of Ubisoft Entertainment in the US and/or other countries.Rainbow Six Siege: Operation Shadow Legacy Reveal Trailer | Ubisoft [NA]http://www.youtube.com/UbisoftNA"
W7VK4DUHvKU,Lil Yachty & Future - Pardon Me (Official Video),10,https://i.ytimg.com/vi/W7VK4DUHvKU/default.jpg,"Watch the official video for Lil Yachty & Future's Pardon Me.Get Lil Yachty's new album Lil Boat 3 here: https://QualityControl.lnk.to/LilBoat3Get Lil Boat 3 merch here: https://QualityControl.lnk.to/LilBoat...Watch Lil Yachty's reality show The Boat Show: https://QualityControl.lnk.to/BoatShowYDFollow Lil Yachty On All Socials: https://www.instagram.com/lilyachty/https://twitter.com/lilyachtyhttps://www.facebook.com/lilyachtysai...Text Yachty At: 404-905-1605Pardon Me lyrics:[Chorus: Future]Pardon me, I been actin' lil' poorPardon me, I been still actin' poorPardon me, I been actin' lil' poorPardon me, I been still actin' poor (EarDrummers)Pardon me, I been still actin' poorPardon me, mix the Act' in the storePardon me, I been still actin' poorPardon me, sippin' lean at the store (Mike WiLL, Mike WiLL)Pardon me, I been still actin' poorPardon me, sippin' stain at the storeCarbine sittin' on the seat and the floorCarbine sittin' on the seat and the floorBarkin', I put that knife on your throatTorture, I'ma set fire to that hoWalk in designer, head down to the toeName the strip club, I throw it[Post-Chorus: Future]Hittin' that throat, she a G.O.A.T.Smashin' that throat, she a G.O.A.T.Feelin' like an igloo nowGoons ready to hit you now[Verse 1: Lil Yachty](Boat)Bring the big F out the houseLet them fuck niggas know who really get foulFour hundred thousand right now (Right now)Four hundred thousand on me right now (Yeah)Pull up on the scene, tryna hit it right nowI wrap the Bentley in snow (Yeah)Pull up at the house, she waitin' outside, the lil' bitch is ready to goGot a Sig Sauer, it's brown like bootIt's still my brother, that nigga the truth, nigga the truthTwenty-five thousand for eight of my teethThree thousand dollars for each every toothIn too close, pull back the top, shoot out the roof (Brrt), go poofI'ma start puttin' these bitches on MARTAI'ma stop puttin' broke hoes on chartersBrother too muddy, he been through too muchIf you standin' and talkin', might black out the waterI was twenty years old with six different whipsPerfect good health, but bought ten different scripts (Woo)Dawg, it's cheaper to boot her outWhen niggas be flexin', nah, this ain't the samePromise it's more for my shit plainNiggas ain't P's, be lookin' like changeDon't you forget who showed you moreShowed you the life and you thought it was strangeHad the driver pick your ass up from LaGrangeIn a black Range, I forgot bad hoes could be lame[Chorus: Future & Lil Yachty]Pardon me, I been actin' lil' poor (Hoo)Pardon me, I been still actin' poor (Hoo)Pardon me, I been actin' lil' poor (Hoo)Pardon me, I been still actin' poor (Woo)Pardon me, I been still actin' poorPardon me, mix the Act' in the storePardon me, I been still actin' poorPardon me, sippin' lean at the store[Verse 2: Future]Pardon me, I'm 'bout to shit on this beatPardon me, I just went crazy on a freakPardon me, I cook that bon appétitPardon me, I bought Chanel for ten G'sJust for the pills and my syrup and my weedPull out that Lam', I got somewhere to beI'm on that, she likeHit from the back and go deep and goI'm on that, she on thatWe on that, they on thatCrocodile spillin' all over the burpBought her a Birk', could've went bought a vertSippin' on syrup got my cup turnin' purp'Pardon me, I got my side bitch on fleekSwiped out the AP and bought the PhilippeBaguettes on her ankle, she walk so eliteFlex double C's and she with them big B'sDouble my cup, man, I'm gone on that EVVS cut, she done turned to a freakDrivin' the Rolls and I came out on a keyPlay with that drum like I'm Tommy LeeCount up that money, I might just ODI took the opp, ride her free, charge a feeMe and Lil Yachty done caught us his thottie[Chorus: Future]Pardon me, I been still actin' poorPardon me, sippin' stain at the storeCarbine sittin' on the seat and the floorCarbine sittin' on the seat and the floorBarkin', I put that knife on your throatTorture, I'ma set fire to that hoWalk in designer, head down to the toeName the strip club, I throw it[Post-Chorus: Future]Hittin' that throat, she a G.O.A.T.Smashin' that throat, she a G.O.A.T.Feelin' like an igloo nowGoons ready to hit you now#LilYachty #LilBoat3 #PardonMe"
W9Aen8hG20Y,When Our Generation Gets Old and Hears a Throwback Song 5,23,https://i.ytimg.com/vi/W9Aen8hG20Y/default.jpg,"500,000 Likes and I’ll drop a Part 6!Thanks for Watching! Like, Subscribe and Comment! 1M Likes and I’ll respond to every comment up until the 1M mark2090 Merch:  https://montlaurel.com/products/mont-laurel-x-kyle-exum-collab-t-shirt?_pos=1&_sid=26016b9e4&_ss=rFollow My Social Media:Instagram: http://www.Instagram.com/KyleExumTikTok: Kyle Exum Twitter: http://www.Twitter.com/KyleExumFacebook: http://www.Facebook.com/KyleExumOfficial Apple Music:  https://music.apple.com/us/artist/kyle-exum/956157064Spotify:  https://open.spotify.com/artist/6EYpuJIDJshhN4CHCg43te?si=8ggbOm3rSAuRSwag2MV9iwStream my “Trap 3 Little Pigs” Song: https://fanlink.to/Trap3LittlePigsApple Music:  https://music.apple.com/us/album/trap-3-little-pigs-single/1468734263Spotify: https://open.spotify.com/track/3WoHA0OFlzXofpKnblSFmr?si=QVTzn8XmQ3ipfH1Wpce1JgSoundCloud: http://www.soundcloud.com/kyleexumYou can Buy my Trap 3 Little Pigs Book Here: Trap 3 Little Pigs (Lyrically Accurate Version): https://amzn.to/30qvtzdTrap 3 Little Pigs (Young Readers Version): https://amzn.to/2LGEG2aStream my “The Exum Household” Album: https://fanlink.to/TheExumHouseholdBusiness Email: kyleexum@select.coMerchandise: https://exumerch.com/———————————————————————————For anyone looking to start your own YouTube channel, here’s the equipment I use to make my videos:Camera: https://amzn.to/2szlclaLighting Set-Up: https://amzn.to/2W5KgxSTripod: https://amzn.to/2RXftnnComputer: https://amzn.to/2RWuDJSMicrophone (For Parodies & Raps): https://amzn.to/2T5xDkjCamera Microphone: https://amzn.to/2S59u0d"
BNeDH6UTmXw,Ten Minutes with Tyler Cameron | Q&A,22,https://i.ytimg.com/vi/BNeDH6UTmXw/default.jpg,Come hang out me with me for 10 minutes where Brown Bear tries to ask some tough questions and I give him some questionable answers. Y’all are about to get to know the real me!► FOLLOW MEInstagram: www.instagram.com/tylerjcameron3 Twitter: www.instagram.com/tylerjcameron3 Facebook: www.facebook.com/tylerjcameron3FILMED & EDITED BY:Jacob Laham (Brown Bear Visuals)www.instagram.com/brownbearvisualswww.youtube.com/brownbearvisualsChris Garbowww.instagram.com/chris2chriswww.youtube.com/chrisjgarbo
6TIsR_7nrNc,Kylie Jenner Reacts To 'WAP' Music Video Backlash,24,https://i.ytimg.com/vi/6TIsR_7nrNc/default.jpg,"Kylie Jenner dissed over cameo in Cardi B and Megan The Stallion WAP music video and she reacts. Plus, Kendall Jenner is getting roasted on TikTok at the moment.  #KendallJenner #WAP #KylieJennerKim Kardashian was spotted getting off a private jet when landing back in Los Angeles on July 28 after visiting her husband Kanye West and having a tearful conversation with him in a car.Read More:https://hollywoodlife.com/2020/07/28/kim-kardashian-returns-la-without-kanye-west-wyoming-trip-pic-video/Starring Ali Stagnitta @alistagnittaWritten & Edited By Nicolas Gonzalez @nictackFootage provided by Celebrity Footagehttp://hollywoodlife.comCONNECT WITH HOLLYWOODLIFEWeb: http://hollywoodlife.comFacebook: http://bit.ly/HollywoodLifeFBTwitter: http://bit.ly/HollywoodLifeTwitter Instagram: http://bit.ly/HollywoodLifeInstagramPinterest: http://bit.ly/HollywoodLifePinterest Newsletter: http://bit.ly/HollywoodLifeNewslettersABOUT HOLLYWOODLIFE We bring you the latest celebrity news about Justin Bieber, Kylie Jenner, Selena Gomez, Kardashians, and much more, every day."
