video_id,title,categoryId,thumbnail_link,description
FnSr820S2Mk,Explained: What happened in deadly Beirut explosion,25,https://i.ytimg.com/vi/FnSr820S2Mk/default.jpg,"The size of the explosion that ripped through the port in the Lebanese capital Beirut has shocked the world.Some 300,000 people have been left homeless, at least 130 were killed and thousands have been injured.But what do we know about where and how it happened?Satellite imagery: Planet Labs IncSUBSCRIBE to our YouTube channel for more videos: http://www.youtube.com/skynews Follow us on Twitter: https://twitter.com/skynews  Like us on Facebook: https://www.facebook.com/skynews Follow us on Instagram: https://www.instagram.com/skynews For more content go to http://news.sky.com and download our apps:  Apple: https://itunes.apple.com/gb/app/sky-news/id316391924?mt=8 Android https://play.google.com/store/apps/details?id=com.bskyb.skynews.android&hl=en_GBSky News videos are now available in Spanish here/Los video de Sky News están disponibles en español aquí https://www.youtube.com/channel/UCzG5BnqHO8oNlrPDW9CYJog"
Uxf0f27n-m4,Forgive Me - Live - Chloe x Halle,24,https://i.ytimg.com/vi/Uxf0f27n-m4/default.jpg,Watch the Forgive Me music video here: https://www.youtube.com/watch?v=Bc9Y58TeZk0Listen & Download 'Ungodly Hour' out now: https://ChloexHalle.lnk.to/UngodlyHourAmazon - https://ChloexHalle.lnk.to/UngodlyHou...Apple Music - https://ChloexHalle.lnk.to/UngodlyHou...iTunes - https://ChloexHalle.lnk.to/UngodlyHou...Spotify - https://ChloexHalle.lnk.to/UngodlyHou...YouTube Music - https://ChloexHalle.lnk.to/UngodlyHou...
Jpl5mWJG2Uo,Haschak Sisters - GLOW (Music Video),10,https://i.ytimg.com/vi/Jpl5mWJG2Uo/default.jpg,"Hi Guys!  Hope you enjoy our new #GLOW music video!  Change is never easy and things change around us everyday.  Whether in age, friend groups, where you live or go to school, it's easy to feel overwhelmed when you suddenly find yourself in the middle of change.  But take heart during the difficult times.  The situations that force you to change can be the very ones that move you closer to your destiny.  Still the same person, but with a new found glow.  Our names are Madison, Gracie, Sierra and Olivia and together we are the Haschak Sisters! We have been dancing all of our lives and LOVE music!  We started this YouTube channel to share our music and hope you’ll join us on our journey!  We love meeting new friends!Like our music? We would LOVE to connect with you online and let you know when we upload future videos! If you like THIS music video and want to help spread the word, it's easy! Simply LIKE, FAVORITE, COMMENT and SHARE this video with YOUR friends on Facebook, Twitter & Instagram! That really helps a lot! #HaschakSistersWe love you!! xoxoOFFICIAL HASCHAK SISTERS LINKSHaschak Sisters Gear Storehttp://Shop.HaschakSisters.comYouTubehttp://YouTube.com/HaschakSistersFacebookhttp://Facebook.com/HaschakSistersTwitterhttp://Twitter.com/HaschakSistersInstagramhttp://Instagram.com/HaschakSistersMusical.ly@HaschakSistersGLOW LYRICS[VERSE ONE]This used to be my favorite songUsed to dance around my room when it came onI left some pictures on the wall And put the rest inside a box, looked through them all [PRE]I don’t really know whats next  No rush, take it step by stepOn my way, but I’m not there yetAnd only getting better [CHORUS]Look at my glowI’ve really come into my ownI don’t know what the future holdsGot big dreams and you should know  Oh oh oh oh oh Still same old me but with a glow [VERSE TWO] Used to hide Talk real quiet Now I shout from the rooftops What I wantWhat I need I speak up speak up speak up And lately I feel inspiredThen I get frustratedSo close, so farGotta be, gotta be, yeah gotta be patient[PRE]I don’t really know whats next  No rush, take it step by stepOn my way, but I’m not there yetAnd only getting better [CHORUS]Look at my glowI’ve really come into my ownI don’t know what the future holdsGot big dreams and you should know  Oh oh oh oh oh Still same old me but with a glow [BRIDGE]Glow, shine, taking my time Know I’ll be fine ya my future real bright Oh, I’m ready for the unknown Glow, shine, taking my time Know I’ll be fine ya my future real bright Oh, I’m ready for the unknown [CHORUS]I'm feeling good, look at my glowI’ve really come into my ownI don’t know what the future holdsGot big dreams and you should know  Oh oh oh oh oh Still same old me but with a glow"
3bC2T0oFwoo,This is Goodbye,23,https://i.ytimg.com/vi/3bC2T0oFwoo/default.jpg,"Only 100 days left. Will you make the most of it?ᴍᴇʀᴄʜ ➤ http://www.unusannus.comᴜɴᴜs ➣ http://www.youtube.com/crankgameplaysᴀɴɴᴜs ➢ http://www.youtube.com/markiplierᴛᴡɪᴛᴛᴇʀ ► http://www.twitter.com/unusannusɪɴsᴛᴀɢʀᴀᴍ ► http://www.instagram.com/unusannusʀᴇᴅᴅɪᴛ ► http://www.reddit.com/r/unusannusᴛᴜᴍʙʟʀ ► https://unusannus.tumblr.com/Edited by ► http://www.youtube.com/markiplierThis channel, along with every video that has or will ever be uploaded on this channel, will be deleted after our year has ended. This is inevitable. Inescapable. Irreversible.Do not archive or re-upload anything. This is our last wish. Our parting gift. Stay true to the purpose of our final year or we shall lay down wrath upon those that attempt to escape the end.Memento Mori.Unus Annus."
JLsDWPsx23c,NBA 2K21: Everything is Game (Current Gen Gameplay),17,https://i.ytimg.com/vi/JLsDWPsx23c/default.jpg,"The dunks, fadeaways, shoes, music, and more—see how Everything is Game in the NBA 2K21 Current Gen Gameplay Trailer. Get ready to play on 9/4 and Pre-order now: https://nba.2k.com/buy"
OpQlY2so3Mk,Let Me In,23,https://i.ytimg.com/vi/OpQlY2so3Mk/default.jpg,"What a ding dong.Get Surfshark VPN at https://surfshark.deals/tomskaEnter promo code TOMSKA for 85% off and 3 months extra for free!Featuring and Co-Written by Matt Ley (@Thelaserbearguy) / (http://twitter.com/thelaserbearguy)Co-Written, Produced, and Directed by Thomas 'TomSka' Ridgewell (@TomSka)Cinematography and Colour Grading by Ciaran O'Brien (http://www.instagram.com/ciaranobriendop)Edited by Elliot Gough (http://twitch.tv/thelovelystuff)Music by Todd ‘LilDeuceDeuce’ Bryanton (@LilDeuceDeuce)Sound Design by Dan Pugsley (http://danpugsley.co.uk)Camera Assistance by Elisa Spigariol (http://twitter.com/doyouknowellie)Animation by Ben ‘Wonchop’ Smallman (@Wonchop)Costume Alterations by Millie (http://twitter.com/millierosalie)Special thanks to Eddie Bowley (@Eddache), Chloe Dungate (@ScarfDemon)CONTENT WARNING: A knife, implied horse murder, and blood that’s totally not just strawberry jam.Secondary Channel (@DarkSquidge)Merch (https://tomskashop.com/)Twitter (http://twitter.com/thetomska)Facebook (http://fb.com/thetomska)Tumblr (http://thetomska.tumblr.com)"
bdKm5hR2mBg,"FMB DZ, Sada Baby, Rio Da Yung OG - The Whoop Way (Official Video) Shot by @JerryPHD",10,https://i.ytimg.com/vi/bdKm5hR2mBg/default.jpg,"Watch the official music video for FMB DZ, Sada Baby, Rio Da Yung OG The Whoop Way” shot by @JerryPHDFor More Videos From Jerry Production Subscribe and FollowFollow Jerry Production:Instagram: http://instagram.com/jerryphdTwitter: http://twitter.com/jerryphdSubscribe to Jerry Production on YouTube for more videos: http://goo.gl/9hgekp#SadaBaby #FMBDZ #RioDaYungOG"
oxpQslt8x5s,"Ford Sticks It To Jeep By Taking The New Bronco On The Rubicon Trail: No, You're Wrong!",2,https://i.ytimg.com/vi/oxpQslt8x5s/default.jpg,"Check out our brand new PODCAST — TFL Talkin' Trucks! ( https://tfltruck.com/podcast )(http://www.TFLoffroad.com) The 2021 Ford Bronco gets its first battle scars by invading the stomping ground belonging to its arch-nemesis, the Jeep Wrangler. Check out these fresh shots of the new Bronco taking on the Rubicon Trail!( http://www.patreon.com/tflcar )  Please visit to support TFLcar & TFLtruck.Check us out on:The Fast Lane Car ( https://www.youtube.com/tflcar )The Fast Lane Truck ( https://www.youtube.com/tfltruck )TFLnow (https://www.youtube.com/tflnow )The Fast Lane Truck: ( http://www.youtube.com/tfltruck )The Fast Lane Car: ( http://www.youtube.com/tflcar )and classic cars as well at:TFLClassics: ( http://www.youtube.com/user/ClassicsUnleashed )Facebook: ( https://www.facebook.com/tfloffroad )Twitter:     (  https://www.twitter.com/tfloffroad )#Ford #Bronco #RubiconTrail"
ol4BJbIZHW4,(animated spellbook) 5E D&D Technology wizard,1,https://i.ytimg.com/vi/ol4BJbIZHW4/default.jpg,PAID SPONSOR: http://heckna.com/Today we are going to go over some Unearthed Arcana from wizards of the coast. Specifically the technology wizard's ability to cast spells through the Internet.
i9zLv77COc8,Our Big Announcement - Introducing TheShawFam,10,https://i.ytimg.com/vi/i9zLv77COc8/default.jpg,"We are so happy to announce our new online community: TheShawFam. Come join us, get some amazing BTS perks, and help us make music that will Share Hope and Spread Joy. To learn more, go to www.theshawfam.com or to www.patreon.com/matandsavanna"
3-144RjSRWI,Pokémon: Twilight Wings | Episode 7 | Sky,20,https://i.ytimg.com/vi/3-144RjSRWI/default.jpg,"It’s all come down to this. Check out the final episode of Pokémon: Twilight Wings, a seven-episode limited anime series set in the Galar region!Official site: http://www.pokemon.com Shop: http://www.pokemoncenter.comFacebook: http://www.facebook.com/Pokemon Twitter: http://www.twitter.com/Pokemon Instagram: http://www.instagram.com/pokemon"
eQhWGnKw5Hc,Boosie Badazz & MO3 - Mop Wit It (Official Video),10,https://i.ytimg.com/vi/eQhWGnKw5Hc/default.jpg,From the album Badazz MO3. Out now!Stream: https://Empire.lnk.to/BadazzMO3@Mo3Badazz#Mo3 #BoosieBadazz #BadazzMO3Official music video by Boosie Badazz & MO3 - Mop Wit It © 2020 Badazz Music Syndicate / H$M Music / EMPIRE
7QJPCIBgV5g,Cinemassacre Channel Update 2020,22,https://i.ytimg.com/vi/7QJPCIBgV5g/default.jpg,"Cinemassacre Channel Update 2020 Recap: I hope everyone is safe and sound! Thanks for watching during all of this, it means a lot to all of us. That said, we need to make a few changes with everything going on in the world. James and Mike Monday is on hiatus until February. Rental Reviews is cancelled, but the RR guys (Justin, Kieran, Tony) will be working behind the scenes and will guest-host some upcoming videos. There will be more random videos (like music videos and scripted reviews), plus monthly AVGN and YKWBS. The new release schedule is every Tuesday and Friday at Noon EST. Conventions and any films we were planning are getting pushed back, but my book should make a lot of headway this year. The new AVGN video game will come out this fall sometime on all systems. 🎮 Add AVGN 1+2 Deluxe to your Steam Wishlist: https://store.steampowered.com/app/1162960/Angry_Video_Game_Nerd_I__II_Deluxe/Follow us on Twitter:James - https://twitter.com/cinemassacreMike Matei - https://twitter.com/Mike_MateiRyan - https://twitter.com/schottrJusty - https://twitter.com/JustySilvermanKieran - https://twitter.com/KieeeeernTony - https://twitter.com/HacktheMoviesCinemassacre Shirts, DVDs, and Blu-rays: https://store.screenwavemedia.com/collections/cinemassacreMerch on Amazon.com: https://amzn.to/2ORk1s8Teespring exclusive shirts: https://teespring.com/stores/cinemassacreClick to Subscribe: http://www.youtube.com/subscription_center?add_user=JamesNintendoNerdFollow#Cinemassacre #JamesRolfe #Update"
Ea04DriyYb4,Video shows Beirut blast as bride poses on her wedding day,25,https://i.ytimg.com/vi/Ea04DriyYb4/default.jpg,"Video captured the terrifying moment when a bride, who was posing for photos on her wedding day, was interrupted by the massive explosion in Beirut that killed at least 135 people on Tuesday.The video shows the bride standing outside her wedding venue posing in a full-length gown.FULL STORY: https://abc7ne.ws/3a3FCrlWelcome to the official YouTube channel for ABC7 Bay Area! We report on stories where you live -- San Francisco, Oakland, San Jose, Santa Rosa -- and everywhere in between. Sometimes serious. Sometimes funny. Always true.Browse our playlists to find stories that matter to you. Don't forget to leave a comment, a thumbs-up, and please subscribe! MORE ABC7 NEWS------------------------------------------------------------------------DOWNLOAD: The ABC7 News app is the best way to stay up to date on Bay Area breaking news, weather, events, traffic, politics, crime, life and more. You can customize your push notifications so you get just the alerts you want. Download it for free and check out the rest of our apps here: www.abc7news.com/appsWebsite: www.abc7news.com-- Get all our special reports, weather, and traffic stories in one place. Facebook: www.facebook.com/abc7newsbayarea--Like our page for buzzy stories, breaking news, and more. Twitter: www.twitter.com/abc7newsbayarea-- Follow us for breaking news as it happens. Instagram: www.instagram.com/abc7newsbayarea -- Tag your photos and videos #ABC7Now and you might be featured on our social media pages, website, app or TV.Don’t forget to subscribe to our channel -- thanks for stopping by!#beirut #bride #explosion"
Qn8dMQJlDZE,If 2020 Gave Us Zombies Instead Of A Pandemic,23,https://i.ytimg.com/vi/Qn8dMQJlDZE/default.jpg,Hi there hello please subscribe so I can feed my cats.Twitter/Instagram: @TheRyanGeorge
8Y_NXBHm92w,Beirut blast: two women on the ground in Lebanon describe the explosion and aftermath | 7NEWS,25,https://i.ytimg.com/vi/8Y_NXBHm92w/default.jpg,"Residents of Beirut awoke to a scene of utter devastation on Wednesday, a day after a massive explosion at the port sent shock waves across the Lebanese capital, killing at least 100 people and wounding thousands. Australian woman Samah Hadid and British journalist Bel Trew joined Michael Usher on The Latest to describe their experiences.Subscribe to 7NEWS for the latest video » https://7news.link/YTSubscribeConnect with 7NEWS onlineVisit » https://7news.com.auFacebook » https://www.facebook.com/7NewsAustraliaTwitter » https://twitter.com/7NewsAustraliaInstagram » https://www.instagram.com/7newsaustralia/ 7NEWS combines the trusted and powerful news brands including Sunrise, The Morning Show, The Latest, and 7NEWS.com.au, delivering unique, engaging and continuous coverage on the issues that matter most to Australians. Watch 7NEWS nightly at 6pm and weekdays at 11:30am and 4pm on Channel 7 and 7plus.#BreakingNews #Beirut #7NEWS"
rr85rpSi0yI,If Real People Commercials were Real Life - CHEVY Fuel Efficiency/Grizzly Bear,23,https://i.ytimg.com/vi/rr85rpSi0yI/default.jpg,"Go to https://Surfshark.deals/zebracorner and use code ZEBRACORNER to get 85% off a 2-year plan and 3 extra months for free. Protect yourself online today!Is this the end of Mahk?  Twitter: @im_Mahk & @Ali_ZebraCornerIG: @im_Mahk & @Ali_ZebraCornerSnap: @comedian_ali-Credits-contributing writers:@SmackTownsend@JamesBaileyhaha Huge shoutout to Mr. Remix for the outro song. Click here for the full song:https://www.youtube.com/watch?v=h3tcp...Get official Zebra Corner gear!: https://represent.com/store/zebra-corneror if you want extras like early access, outtakes, longer cuts, alternate jokes and even your own personal Mahk. Go to https://www.patreon.com/ZebraCorner"
K_uCyxNsHpo,Brooklyn's 10 DATES in 10 DAYS | Meet Jorge (Date #1),24,https://i.ytimg.com/vi/K_uCyxNsHpo/default.jpg,"Brooklyn is going on TEN DATES in TEN DAYS! (This #10DatesIn10Days is mostly for fun, but we are all secretly hoping she finds her BOO!) You'll get to vote for your favorites each week, and at the end of the 10 dates she'll go on a SECOND date with whoever ya'll, along with her, help choose!✅ Shop our NEW collection of Activewear, Loungewear, Joggers, Mascara, Jewelry/Hair Accessories HERE! (IT SELLS SO FAST!) https://brooklynandbaileyshop.com/ Our friend Alyssa Mikesell did the 15 date/15 day version and ended up finding her BOYFRIEND! Her mom, Betsy Mikesell (and our Beddy's partner), had a dream that Brooklyn just HAD TO DO THIS too!!!! She felt inspired that Brooklyn would find her boyfriend as well, and called Brooklyn immediately the next morning! You can follow both Alyssa and Betsy HERE! Alyssa Mikesell: https://www.youtube.com/channel/UCpKWfroBPkXYzBsyNdAuK8wBetsy Mikesell: https://www.youtube.com/channel/UCmZNqqNBVbLU1kT1T-YmSZwWhen Betsy called her, Brooklyn kind of laughed it off... but as she thought about it more and more, she decided it would be FUN to do something like this (with zero pressure to find someone)! So she AGREED! Betsy and Alyssa quickly went to work, posting on their IGS for their followers to have their cute brothers or sons apply! Both Betsy and her friend Kaitlyn took turns filming with Brooklyn on the dates.The idea for this series is... that Brooklyn films her 10 Dates in 10 Days and we will upload them HERE every MWF starting today! So you'll be getting several videos from us EACH WEEK for the next 3 weeks or so! THEN as you watch each video, you can VOTE in the comment for the boy you think matches up THE BEST with Brooklyn for that video. As each video goes live, you might have to go back and watch the others again just to see which boy you think Brooklyn vibes THE MOST with!Each boy plans his own #date, and not only are these boys CUTE... but they are SUPER FUN and planned great date ideas! Brooklyn is having so much fun! (Safety precautions are taken to ensure safety based on CDC guidelines. The boys have been asked to either social distance with their families or take a test prior to filming, temperature checks before dates, masks in public with appropriate social distancing, and hand sanitizer breaks.) Is this it??? Do you think Brooklyn will find her #boyfriend in this series??? She's been single for three years now, but I SURE DO HOPE SO! *no pressure*If this video series does well, do you think we should TRY IT WITH KAMRI NEXT???This video was just as fun to film as our recent Twin Swap videos. You can check those out here!💥 Identical Twins Switch Places | Will Bailey’s Boyfriend Notice? (over 17 MILLION views)https://youtu.be/Nun_4w8m_SY 💥 Identical Twins DRIVE THRU Swap Challenge (over 9 MILLION views)https://youtu.be/HoLipntmsUE 💥 Identical Twins 2-Car DRIVE THRU Challenge (over 6 MILLION views)https://youtu.be/P-SEulc_5vE 💥 Identical Twins PREGNANT with TWINS for 24 Hours! *not real* (over 2 MILLION views)https://youtu.be/fqLAWwGOjxI💥 Identical Twin Wears a WIG in Public to See if Her Twin Sister Notices! (over 2 MILLION views)https://youtu.be/H78hubx5MwoWhat did you think? What other awesome videos ideas would you like to see us film? Comment below!💋's - Bailey_Where else can YOU FIND US???   📸  Instagram | http://instagram.com/brooklynandbailey   🐥  Twitter | http://twitter.com/brookandbailey   👤  Facebook | http://facebook.com/brooklynandbailey   👻  SnapChat | http://snapchat.com/add/BrookAndBailey   ⏰  Tik Tok | @BrooklynAndBailey   🎶  Spotify | https://open.spotify.com/artist/4Y8tcJEqYuIDSNAZEqu9Nd   ☁️  SoundCloud | http://soundcloud.com/brooklynandbailey_STREAM our Original Music! 🎤🎶👉🏻 Dance Like Me - https://brooklynandbailey.lnk.to/DanceLikeMe👉🏻 Simple Things - https://brooklynandbailey.lnk.to/SimpleThings👉🏻 What We're Made Of - https://BrooklynandBailey.lnk.to/WhatWereMadeOf_FTC Disclaimer: This is not a sponsored video."
hpMeCem6Hss,"I FOUGHT BRYCE HALL...Ft. Mike Majlak, Lana Rhoades, Steve will do it, Nelk Boys, Blake Gray",24,https://i.ytimg.com/vi/hpMeCem6Hss/default.jpg,It is what it is.... New drop coming this month 8.12.20 as well as 8.19.20! Subscribe to the channel! Click Here!https://www.youtube.com/channel/UCWTQG2aMDYKGDqYEGqJb1FA/?sub_confirmation=1GET MY DAILY WORKOUTS: https://www.bradleymartyn.com/join-the-squadGet the Apparel & Gear! http://WWW.BMFITGEAR.COM TRAINING PROGRAMS AND MEAL PLANS! https://theculturecast.com/collection... INTERACT WITH ME!+ INSTAGRAM: http://www.instagram.com/bradleymartynTWITTER: https://twitter.com/bradleymartyn FACEBOOK: http://www.facebook.com/bradleymartyn SNAPCHAT: BRADLEYMARTYN ============================================= BMFIT Gear And Apparel+ BMFIT GEAR! : http://WWW.BMFITGEAR.COM
gpY9qUbPXbM,Inside Beirut After the Explosion | WSJ,25,https://i.ytimg.com/vi/gpY9qUbPXbM/default.jpg,"Note: Additional footage also provided by: Karim Sokhn via Associated PressWSJ’s Dion Nissenbaum ​returned to his apartment in Beirut, Lebanon, to assess the damage from the deadly explosion that injured his daughter and ripped through his neighborhood. In a video, he reports on the challenges survivors face. Photo: Agence France-Presse/Getty ImagesMore from the Wall Street Journal:Visit WSJ.com: http://www.wsj.comVisit the WSJ Video Center: https://wsj.com/videoOn Facebook: https://www.facebook.com/pg/wsj/videos/On Twitter: https://twitter.com/WSJOn Snapchat: https://on.wsj.com/2ratjSM#WSJ #Beirut #Lebanon"
uf-36RC6JHE,Lapiz  Conciente - El Descanso Eterno,10,https://i.ytimg.com/vi/uf-36RC6JHE/default.jpg,Producido por: Linkon / Reason Dirigido por: RSK Fama Films Copyright: Lapiz Music Ent.Follow Lápiz Conciente!Facebook: http://www.facebook.com/LapizconcienteofficialTwitter: http://www.twitter.com/lapizconcienteInstagram: http://www.instagram.com/lapizconciente
A3VYsISvUy4,Atalanta vs. PSG | Champions League Quarterfinal Highlights | UCL on CBS Sports,17,https://i.ytimg.com/vi/A3VYsISvUy4/default.jpg,"In a one-off match for a spot in the semifinals, Atalanta and Paris Saint-Germain sought to advance and keep their dreams of European glory alive.Stream every UEFA Champions League match live on CBS All Access:http://bit.ly/ucloncbssports#PSG #Neymar #Atalanta #ChampionsLeague #UCL #UEFA #ParisSaintGermain #mbappe"
3C66w5Z0ixs,I ASKED HER TO BE MY GIRLFRIEND...,22,https://i.ytimg.com/vi/3C66w5Z0ixs/default.jpg,"SUBSCRIBE to BRAWADIS ▶ http://bit.ly/SubscribeToBrawadisFOLLOW ME ON SOCIAL▶ Twitter: https://twitter.com/Brawadis▶ Instagram: https://www.instagram.com/brawadis/▶ Snapchat: brawadisHi! I’m Brandon Awadis and I like to make dope vlogs, pranks, reactions, challenges and basketball videos. Don’t forget to subscribe and come be a part of the BrawadSquad!"
