video_id,title,categoryId,thumbnail_link,description
6IN4ZcZAUbA,The global coffee crisis is coming,25,https://i.ytimg.com/vi/6IN4ZcZAUbA/default.jpg,"It's becoming harder and harder to grow. Become a Video Lab member! http://bit.ly/video-labSources and Additional Reading:Andres Guhl http://etd.fcla.edu/UF/UFE0003960/guhl_a.pdfhttps://revistas.uniandes.edu.co/doi/pdf/10.7440/res32.2009.08Phillip A. Hough and Jennifer Blair https://www.researchgate.net/publicat...Mike Hoffman https://fortune.com/2017/06/14/trump-paris-climate-change-agreement-coffee-prices/Christian Bunn et al. https://link.springer.com/article/10.1007/s10584-014-1306-xDavis et al., https://advances.sciencemag.org/content/5/1/eaav3473CABI https://www.cabi.org/Federación Nacional de Cafeteros https://federaciondecafeteros.org/Richard Schiffman (Yale) https://e360.yale.edu/features/as-cli...Jessica Eise and Natalie Lambert https://ijoc.org/index.php/ijoc/article/view/11777/2907https://apps.fas.usda.gov/newgainapi/api/report/downloadreportbyfilename?filename=Coffee%20Annual_Bogota_Colombia_5-14-2018.pdf Andy Jarvis https://link.springer.com/article/10.1007/s10584-012-0500-y Coffee is one of the most popular commodities on Earth. It's grown by nearly 125 million farmers, from Latin America to Africa to Asia. But as man-made climate change warms the atmosphere, the notoriously particular coffee plant is struggling. Places like Colombia, which once had the perfect climate to grow Arabica coffee, are changing. Now, experts estimate the amount of land that can sustain coffee will fall 50 percent by 2050. It's not just a crisis for consumers but for the millions who have made a livelihood out of growing coffee. Vox.com is a news website that helps you cut through the noise and understand what's really driving the events in the headlines. Check out http://www.vox.com.Watch our full video catalog: http://goo.gl/IZONyEFollow Vox on Facebook: http://goo.gl/U2g06oOr Twitter: http://goo.gl/XFrZ5H"
ar6UiTbuoSU,"THE OFFICIAL REVEAL OF MY NEW $10,000,000 HOUSE! (Full Tour)",24,https://i.ytimg.com/vi/ar6UiTbuoSU/default.jpg,"IT'S FINALLY HERE OMG!!!!!!This is the official house tour of my brand new $10,000,000 home. I am so happy with this purchase and I'm so excited to start my new life here, and make some crazy videos!! Subscribe if you're new!!• SUBSCRIBE!!! ► http://bit.ly/SubToRug• NEW GFuel Flavor ► https://gfuel.com/MY GAMING STUFF:• MY GAMING CHANNEL ► http://bit.ly/RugGaming• FOLLOW MY TWITCH ► https://www.twitch.tv/rugGO SPAM MY OTHER PAGES!!Instagram ► https://www.instagram.com/fazerug/TikTok ► https://www.tiktok.com/@rugFacebook ► https://www.facebook.com/RealFaZeRug/Twitter ► https://twitter.com/FaZeRugSnapchat ► thefazerug"
28YwvwneKoY,My Decaying Mind in Quarantine,23,https://i.ytimg.com/vi/28YwvwneKoY/default.jpg,"Check out Cafe Chaos on kickstarter, supplies are limit-ED (no theyre not)➤ https://www.kickstarter.com/projects/theodd1sout/cafe-chaos-the-odd-1s-out?ref=57jg4y Thank you Night-mind for voicing the narrator ➤ https://www.youtube.com/channel/UC58IKuPHnZkdCZ6T5mSRGCg DJ's Stuff (thank him for making me buff) Animators VS Games ➤ https://www.youtube.com/channel/UCPxD9pif2FIamjralQYC23g DJ Welch ➤ https://www.youtube.com/channel/UCEgg3qOJI2Ep2Iq8ONE07DA Additional artists: GetMadz ➤ https://www.youtube.com/user/TheMadz2012 Rushlight Invader ➤ https://www.youtube.com/user/RushLightInvader Annie Loomis ➤ https://twitter.com/annieloomisart PantslessPajamas ➤ https://www.youtube.com/channel/UCR0O-1cvuPNxDosvSDLpWHg Hexrin ➤ https://twitter.com/hexriin Funymony ➤ https://www.youtube.com/user/funymony Nine Doodles ➤ https://twitter.com/NineDoodles Georden Whitman ➤ https://twitter.com/geordenwhitman Curry Swirl ➤ https://twitter.com/curry_swirl lollergator ➤ https://twitter.com/lollergator Second channel ➤ https://www.youtube.com/channel/UC0GLNhtTu7yI8rl6ZZGeezw Twitter ➤ https://twitter.com/Theodd1sout Instagram ➤ https://www.instagram.com/theodd1sout/ Website/Merch ➤ https://theodd1sout.com/"
YHX4lUSGUBI,'Don't mess with Dame Dolla' - Stephen A. reacts to Lillard's beef with Paul George | First Take,17,https://i.ytimg.com/vi/YHX4lUSGUBI/default.jpg,"Stephen A. Smith explains why LA Clippers SF Paul George is under more pressure than Portland Trail Blazers PG Damian Lillard this season following PG and Patrick Beverley's beef with Lillard. #FirstTake #NBA ✔️Subscribe to ESPN+ https://plus.espn.com/✔️ Get the ESPN App: http://www.espn.com/espn/apps/espn✔️Subscribe to ESPN on YouTube: http://es.pn/SUBSCRIBEtoYOUTUBE✔️ Subscribe to NBA on ESPN on YouTube: http://bit.ly/SUBSCRIBEtoNBAonESPN✔️ Watch ESPN on YouTube TV: http://es.pn/YouTubeTVESPN on Social Media:► Follow on Twitter: http://www.twitter.com/espn► Like on Facebook: http://www.facebook.com/espn► Follow on Instagram: http://www.instagram.com/espnVisit ESPN on YouTube to get up-to-the-minute sports news coverage, scores, highlights and commentary for NFL, NHL, MLB, NBA, College Football, NCAA Basketball, soccer and more. More on ESPN.com: https://www.espn.com"
KmVG1Yx1kwQ,3 DAYS with the Samsung Galaxy Note 20 Ultra! | The Tech Chap,28,https://i.ytimg.com/vi/KmVG1Yx1kwQ/default.jpg,"What's it like using the Samsung Galaxy Note 20 Ultra? I switched to the Note 20 Ultra 3 days ago, and I want to share my real world impressions using Samsung's latest flagship smartphone! Full Review Coming Soon! Amazon US: https://amzn.to/2FahxDT l UK: https://amzn.to/33JQolD (Paid Links)#GalaxyNote20Ultra #Note20Ultra #Note20 #Phone #SamsungNotice: [Paid Links] As an Amazon Associate I earn from qualifying purchases. The Tech Chap is a member of the Amazon Associate Program, and can earn fees from links to Amazon.com and Amazon.co.uk.Can't get enough of your TECH? Why not SUBSCRIBE? (it's free!) 😄▶ YouTube: https://bit.ly/2UyCBGq 📷 Instagram: https://www.instagram.com/TheTechChap🐦Twitter: https://twitter.com/TheTechChap🎵 Music by Epidemic & Artlist"
FQnJRVn3QVk,Watching Movie Trailers... Then Guessing Their Review Scores,24,https://i.ytimg.com/vi/FQnJRVn3QVk/default.jpg,"Welcome to the Chill Zone, where we chill and stuff. We're watching movie trailers with millions of views and guessing their critic scores!Twitter: https://twitter.com/theDMatthewsInstagram: https://www.instagram.com/dylanwillnotparticipate/"
PHYtv0v2DeA,"NUGGETS at LAKERS | FULL GAME HIGHLIGHTS | August 10, 2020",17,https://i.ytimg.com/vi/PHYtv0v2DeA/default.jpg,"NUGGETS at LAKERS | FULL GAME HIGHLIGHTS | August 10, 2020Kyle Kuzma (25 PTS) knocked down a 3PM from the wing with 0.4 seconds remaining to lift the Los Angeles Lakers over the Denver Nuggets, 124-121. LeBron James led the Lakers with 29 PTS and 12 AST, while Anthony Davis added 27 PTS in the victory. Michael Porter Jr. paced the Nuggets with 15 PTS.Next Games:Kings at Lakers- August 13 at 1:30 pm/et on NBA League PassClippers at Nuggets- August 12 at 9:00 pm/et on ESPNSubscribe to the NBA: https://on.nba.com/2JX5gSN Full Game Highlights Playlist: https://on.nba.com/2rjGMgeFor news, stories, highlights and more, go to our official website at https://nba_webonly.app.link/nbasiteGet NBA LEAGUE PASS: https://nba.app.link/nbaleaguepass5"
jp47GeO6k6Q,How Does He Get Away With This?,17,https://i.ytimg.com/vi/jp47GeO6k6Q/default.jpg,"🔥GET YOUR EXCLUSIVE BASKETBALL SHORTS NOW! https://dopelocker.net/collections/team-shorts-%F0%9F%94%A5 FOR $39.95 USD📢 DISCOUNT CODE JXMY FOR 5% OFF❗ CUSTOM STITCHED TEAM LOGOS ON EVERY SHORT✈️ FREE NEXT DAY DELIVERY🚒 2 BACK ZIPPER POCKETSMusic provided by the talented LCS Beats: https://www.youtube.com/channel/UCc-LuGddmv1ETE5X-UiN6iQFollow me on Instagram: https: //www.instagram.com/jxmyhighroller Be sure to subscribe and turn on notifications for the latest content from ya boy Jxmy! We doin this a couple times a week, every week! *Copyright Disclaimer Under Section 107 of the Copyright Act 1976, allowance is made for fair use for purposes such as criticism, comment, news reporting, teaching, scholarship, and research. Fair use is a use permitted by copyright statute that might otherwise be infringing. Non-profit, educational or personal use tips the balance in favor of fair use. No copyright infringement intended. ALL RIGHTS BELONG TO THEIR RESPECTIVE OWNERS"
8QsH_xPQFqM,ALREADY | Black Is King | Aliya Janell | Kany Diabate Choreography | Queens N Lettos,24,https://i.ytimg.com/vi/8QsH_xPQFqM/default.jpg,"Had the pleasure of learning from this queen named Kany Diabate. She was actually one of the choreographers who choreographed for Beyonce on Black Is King. She is such a talented beautiful soul and this will definitely not be the last of us together:)Thank you to my main one @THEZURISADDAI for capturing/editing this perfectly, enjoy:)Watch Aliya's QNL tutorials and Live classes NOW: https://www.fullouttv.com/authors/aliyajanellFollow Aliya Janell on instagram : https://www.instagram.com/thealiyajanell/Follow Queens N Lettos on instagram : https://www.instagram.com/QueensNLettosOfficial/Watch QNL tutorials and Live classes: https://www.fullouttv.com/authors/aliyajanellSubscribe to Aliya & Tallie's couple channel 'How We Do Love'https://www.youtube.com/channel/UCMzqYWEenPRd2LScxfU6oOw"
xTpr7piQu2M,FUT 21 | Official Trailer,20,https://i.ytimg.com/vi/xTpr7piQu2M/default.jpg,"Play with friends, customise your stadium, and team up with the FIFA 21 Ultimate Team Community. See what’s new in FUT 21: http://x.ea.com/64220Introducing the FUT ICON 100, 100 of football’s greatest ever players. See the new ICONS in FIFA 21 Ultimate Team: http://x.ea.com/64221On the street and in the stadium, see what's new in FIFA 21: http://x.ea.com/64222FIFA 21 releases October 9, 2020. Pre-order the Ultimate Edition before August 14th for an untradeable Ones to Watch player for your FUT 21 team: http://x.ea.com/64223Entitle for FIFA 21 on either PlayStation 4 or Xbox One before the release of FIFA 22 and upgrade your game for the equivalent next generation console (Xbox Series X or PlayStation 5) at no additional cost: http://x.ea.com/64224Subscribe to see more FIFA 21 videos: http://bit.ly/pzw4VD.#FIFA21 #FUT21 #UltimateTeam"
bGtR3l_JeUo,Uncle Roger Meet Egg Fried Rice Lady (@Hersha Patel),23,https://i.ytimg.com/vi/bGtR3l_JeUo/default.jpg,"Uncle Roger finally meets egg fried rice lady, Hersha Patel. Will they get along? Does she actually know how to make egg fried rice?Support Uncle Roger with superchat so I can buy some rice!Follow Hersha! ⬇️Youtube: https://www.youtube.com/c/HershaPatelInstagram: https://www.instagram.com/hershapatel/Twitter: https://twitter.com/hershapatel1Biryani photo by Marc Matsumoto: https://www.instagram.com/norecipes/Subscribe to my niece J Lou also: https://www.youtube.com/channel/UC530gKG2oJ26FIgQzAyqqowVideography by @Ray Roberts: https://www.youtube.com/user/RayRobertsFilmsUncle Roger is the creation of UK-based comedian Nigel Ng.💰 Support me so I can keep making videos for you!Patreon: https://www.patreon.com/ricetomeetyoupodMerch: https://ricetomeetyoupod.com/merchShoutouts: https://www.cameo.com/mrnigelng🎙 And check out the podcast:https://ricetomeetyoupod.com/🎥 Follow me on my socials for more content: https://www.instagram.com/mrnigelng/https://twitter.com/MrNigelNghttps://www.tiktok.com/@mrnigelng🌎 If you want me to tour your area, put your city in here: http://bit.ly/nigelngmail"
1hx4vCChBlI,robot boyfriend,24,https://i.ytimg.com/vi/1hx4vCChBlI/default.jpg,yep
lcnWx5tiwhM,Exposing My Browsing History!,22,https://i.ytimg.com/vi/lcnWx5tiwhM/default.jpg,"I delve into more of the weird internet history! Contains a paid promotion for Square Enix! Final Fantasy VII Remake is on sale NOW check it out: https://bit.ly/FF7AmazingPhil Offer ends August 19th, 2020. At participating retailers only. Discount not available on all versions. Offers may vary. Terms & conditions apply.Trying to catch and rescue a pigeon: https://www.youtube.com/watch?v=IjhCMBwpAwg&Find more of me here! NEW MERCH: http://www.amazingphilshop.comTWITTER: http://www.twitter.com/amazingphilFACEBOOK: http://www.facebook.com/amazingphilINSTAGRAM: http://www.instagram.com/amazingphilTUMBLR: http://www.amazingphil.tumblr.comMusic: Kevin Macleod - Incompetech.com"
RN8uoBwRr1k,Binging with Babish: Paunch Burger from Parks & Rec,24,https://i.ytimg.com/vi/RN8uoBwRr1k/default.jpg,"Check out Thrive Market today and choose a free gift, up to $22 value, when you join here: http://thrivemarket.com/BingingWithBabishRecipe: https://www.bingingwithbabish.com/recipes/paunch-burger-parks-and-recMusic: Add And by Broke for Freehttps://soundcloud.com/broke-for-freeMy playlist of preferred cooking tunes, Bangers with Babish!https://spoti.fi/2TYXmiYBinging With Babish Website: http://bit.ly/BingingBabishWebsiteBasics With Babish Website: http://bit.ly/BasicsWithBabishWebsitePatreon: http://bit.ly/BingingPatreonInstagram: http://bit.ly/BabishInstagramFacebook: http://bit.ly/BabishFacebookTwitter: http://bit.ly/BabishTwitter"
goOmZUwQYlA,100k,24,https://i.ytimg.com/vi/goOmZUwQYlA/default.jpg,thanks
KnE6u4hFx14,PAINTING OUR FACES ON BRENT'S NEW HOUSE! (REVENGE),26,https://i.ytimg.com/vi/KnE6u4hFx14/default.jpg,"Wait untill you guys see his reaction. Thank you guys so much for watching! Make sure to LIKE the video and SUBSCRIBE!@ZHC @Ben Azelart @Brent Rivera @Jeremy Hutchins @Dominic Brack If you see this, comment who you think won the little painting challenge haha love you guys :)"
iR7UweUPeNw,"Can LeBron, AD and Kyle Kuzma Become LA's New ‘Big Three’? | NBA on TNT Tuesday",17,https://i.ytimg.com/vi/iR7UweUPeNw/default.jpg,"After Kyle Kuzma hit the game-winning shot for the Los Angeles Lakers, the crew discusses whether Kuzma can become LA's third star player. Watch highlights from Inside the NBA with Shaq, Charles Barkley, Kenny Smith and Ernie Johnson and more! Subscribe now to be updated on the latest videos: https://www.youtube.com/nbaontnt?sub_confirmation=1Connect with NBA on TNT:Follow NBA on TNT on Twitter: https://twitter.com/NBAonTNTLike NBA on TNT on Facebook: https://www.facebook.com/NBAONTNT/Follow NBA on TNT on Instagram: https://www.instagram.com/nbaontnt/?hl=en"
5JC2trEXxhE,Seattle Police Chief Carmen Best will resign Tuesday,25,https://i.ytimg.com/vi/5JC2trEXxhE/default.jpg,Seattle Police Chief Carmen Best plans to resign on Tuesday. The news comes on the same day the city council voted to cut the police department's budget. Best and Seattle Mayor Jenny Durkan are scheduled to speak at a news conference Tuesday at 11 a.m. https://www.king5.com/article/news/local/protests/seattle-police-carmen-best-is-resigning-sources-say/281-c5a9f277-68a7-45f1-b3dc-4c4d616a7458
AG9qDVXEemc,CASH NASTY MADE A MISTAKE CHALLENGING ME TO THIS 1V1... @Agent 02,20,https://i.ytimg.com/vi/AG9qDVXEemc/default.jpg,Came in there with one mission. Win the 1v1 vs. Cash Nasty no matter the cost.👉 3 PT CONTEST vs. FLIGHT: https://www.youtube.com/channel/UCpmGbhQHg0nf3Ec2OreFHoQ?sub_confirmation=1🔴 Cash's Channel: https://www.youtube.com/watch?v=wf1qXOqA02w⚡ AMP CHANNEL: https://www.youtube.com/channel/UCJbYdyufHR-cxOuY96KIoqA?sub_confirmation=1🎤 NEW PODCAST: https://www.youtube.com/channel/UC_q9jnFFLHSHgtVDc0ERNlg?sub_confirmation=1👕  Merch: http://www.agent.clothing/🔴 SUBSCRIBE: http://goo.gl/s8cskJ 🐦 TWITTER: https://twitter.com/CallMeAgent00 📸 INSTAGRAM: https://www.instagram.com/callmeagentzero/
3qxGj18nAR4,MY FIRST DAY OF SCHOOL VLOG  *Senior Year* 2020-21,22,https://i.ytimg.com/vi/3qxGj18nAR4/default.jpg,"Welcome to nat's life lmao.For business-nathalycuevas@select.co P.O box : 1030 N Mountain Ave #160 Ontario CA,, 91762Follow meeeeeeeeee :Instagram- @NathalyycuevasTik Tok- @NathalyycuevasSnapchat- @Nathalyyy.xxTwitter- @Nathalyyy_xxFAQ-Age- 16Birthday- August 29, 2003Camera I use- Cannon G7x mark iiEditing software- Final Cut Pro XThanks for watching ily 💓"
BpXkl4VdFhA,Swapping Outfits With A Drag Queen!,23,https://i.ytimg.com/vi/BpXkl4VdFhA/default.jpg,"Swapping Outfits With A Drag Queen!I decided it would be fun to swap styles with Jake Warden, who IS THRIVING with being a drag queen. I also swapped outfits with my little sister, Tana Mongeau, Nikita Dragun, and the Beverly Hills brat, James Charles, Daisy Marquez and Amber Scholl, Chantel Jeffries, and an E-girl, you guys enjoyed that! Let me know who else you want me to do a style swap with!!Jakes Video: https://youtu.be/dDP5SgJbZcE"
Gj_SlGSZFgA,Who Makes The BEST Hot Dog *Glizzy* 🌭,24,https://i.ytimg.com/vi/Gj_SlGSZFgA/default.jpg,"Today the boys go to different fast food spots to see who makes the best hot dog! (Dog haus, Five guys, Shake Shack, Wienersnitchel ⭐ Text me! 805 - 398 - 6092Who Makes The BEST Fast Food Chicken Nuggets!?► https://www.youtube.com/watch?v=w8eHl0_72wM&list=PLKzulMBDeOMqt_cp-H4TAmjCdhwka5PIP&index=2Who Makes The BEST Fast Food CHEESE BURGER?► https://www.youtube.com/watch?v=4QqwhZ5yzlk&list=PLKzulMBDeOMqt_cp-H4TAmjCdhwka5PIP&index=3★ Follow me on social media @Jesser ★●Instagram https://instagram.com/jesser●Twitter https://twitter.com/jesser2ND Channel - @JSR ► https://www.youtube.com/user/Jesserthelazerhd★BUCKETSQUAD MERCH★► bucketsquad.com2HYPE Group Channel@2HYPE Thanks for being in the video@Kristopher London @ZackTTG @Jiedel ●Edited by https://www.youtube.com/c/RickleTickle#BucketSquad"
vzXYz61U3Gk,We Need Some Time Apart,19,https://i.ytimg.com/vi/vzXYz61U3Gk/default.jpg,"[Episode 261] Life in close quarters can be full on when you're carting your life around on a boat together, so we're spending a bit of time apart as we head back westwards along southern Portugal.We want to take the varnish off and speak our mind about some issues that we think are important, and give you guys a sense of some aspects of our lives away from the camera.Philosophize This! Podcast By Stephen Westhttps://bit.ly/Philosophize-ThisHappiness Hypothesis Jonathan Haidghthttps://www.happinesshypothesis.com/Psychology Podcast - Scott Barry Kaufmanhttps://scottbarrykaufman.com/podcast/Happiness Labhttps://www.happinesslab.fm/Song Credits:00:00 Hollow Coves - Heatwave - https://open.spotify.com/artist/7IAFAOtc9kTYNTizhLSWM6?si=Qy2VBj1MT2exbHD77vjECQ02:13 Good Lee & Andrew Rothschild - 24 - https://www.facebook.com/AndrewRothschilds/ 05:58 Honey Hounds - Easy Like The Breeze -  https://open.spotify.com/artist/2gBYe3dJe0NroE6tej4XnP 09:02 Brother Mane - Epiphany - https://open.spotify.com/artist/2vC1DrTfUraHejWRM6e9Bm?si=CCzX4xs6SH6tHFKH5PoPHQ14:17 Bill Beaumont - For The Birds Outside My Window - https://billbeaumont.bandcamp.com17:19 Lachlan Ross - City Lights - https://Lachlanrossvisuals.comThanks to our amazing featured music artists for supporting the show! You can listen to them all on our Spotify playlist: https://www.tinyurl.com/t9fqqufProduced by Elayna & RileyEdited by Andrew DickersonFollow our Insta's for more!!  https://www.instagram.com/elayna.carausuhttps://www.instagram.com/riley.whitelumDon't forget to like us on Facebook!http://www.facebook.com/sailinglavagabondeJoin our Patreon Crew. For LIVE broadcasts, exclusive content and other perks! Please become a Patron and support our production.http://www.patreon.com/LaVagabondeDownload Elaynas music here!https://elaynac.bandcamp.comPick up some official La Vaga merch and help support our journey!http://shop-lavagabonde.comSubscribe to our new sexy website for blog posts and updates!http://www.sailing-lavagabonde.comFollow us on Twitter!http://twitter.com/@sailing_lavagaLike Elaynas Music page on the book!http://www.facebook.com/elaynacmusicFAQWhat cameras do we use?BIG CAMERA: http://amzn.to/1t6fAfYOTHER BIG CAMERA: http://amzn.to/2rybQE2HANDY CAM: http://amzn.to/25KvT0xGOPRO: http://amzn.to/1t6haPcDRONE: http://amzn.to/2ooXPLsSELFIE STICK: http://bit.ly/Spivo-StickWhat software do we use?Adobe Premiere Pro https://bit.ly/Adobe-PremierProPredict Wind http://bit.ly/PredictWindForecasts"
koHs2-xKdEk,2HYPE Goes Shark Fishing!,17,https://i.ytimg.com/vi/koHs2-xKdEk/default.jpg,Welcome to the Official 2HYPE Channel! Uploads are Every Saturday!New merch drop August 15th 3pm PST!http://www.2hype.com★FOLLOW US ON INSTAGRAM★https://www.instagram.com/2hypehouse/★2HYPE MEMBERS★JESSER -Channel: https://www.youtube.com/user/JesserPlaysInstagram https://www.instagram.com/jesser/KRIS -Channel: https://www.youtube.com/KristopherLondonInstagram: https://www.instagram.com/iamkrislondon/JAMES -Channel: https://www.youtube.com/user/JiedelPlaysInstagram: https://www.instagram.com/jiedel/CASH -Channel: https://www.youtube.com/user/WhatChaMaCallingInstagram: https://www.instagram.com/cashnasty/ZACK -Channel: https://www.youtube.com/channel/UCTs5PJGf9AwnA7mNV3ejNTQInstagram: https://www.instagram.com/zackttg/MOPI -Channel: https://www.youtube.com/channel/UCOYSYNsxTfGTGbMu2c-kpfgInstagram: https://www.instagram.com/commonmopi/#2HYPE
hEU_MnFTJ_c,LIVE BIRTH OF OUR BABY BOY *EMOTIONAL*,22,https://i.ytimg.com/vi/hEU_MnFTJ_c/default.jpg,"Meet Oliver Rhett Fisher! This was such a special and emotional day for our family to meet our baby boy, we hope you enjoy this special moment in our lives.  https://ffm.to/ejdrk6aLink to new single  A Little Like Me"
tbsu-AWH-C0,Stephen Sharer - SLUSHIE (Official Music Video),10,https://i.ytimg.com/vi/tbsu-AWH-C0/default.jpg,"👚GET OFFICIAL “SLUSHIE” MERCH NOW!! ━►https://stephensharer.com/Today is the day you all have been waiting for - the official Stephen Sharer “Slushie” music video is finally here! Stephen Sharer, Grace Sharer, and their Share the love family BEST FRIEND BFFS Chase and Alex hang out by the pool all afternoon enjoying some delicious RAINBOW COLOR SLUSHIES! Throughout this BRAND NEW Share The Love music video vlog you will see Stephen Sharer doing the super epic #Slushie TikTok Dance! Thats right, you can learn these epic TikTok Dances and try them yourself to this new Stephen Sharer Song called Slushie!! Let me know what you love best about this new summer song #Slushie and get your awesome merch! #MusicVideo Listen to SLUSHIE song out now!Spotify ━► https://open.spotify.com/album/73HTL5AC7ZSaZgdqybelvK Apple Music ━► https://music.apple.com/us/album/slushie-single/1524995420Produced and cowritten with: LYRESongwriter - Alina Smith, Annalise Morelli, Stephen Sharer ❇️ MORE EPIC VLOGS ❇️Stephen Sharer - SLUSHIE (Official Lyric Video) https://youtu.be/tA0Nu20eQi0 Stephen Sharer - SLUSHIE (Behind The Scenes of Exclusive Music Video Reveal) https://youtu.be/5XwxTuyuZTQ Stephen Sharer - In My Jeep (Official Music Video) https://youtu.be/0jWpZc7gNeI More Music Videos!! https://www.youtube.com/playlist?list=PLQdOBb866XKgItgQBneS_gwPVWi-AZVvu ————————————————————————————————📦 Fan Mail Address: Stephen Sharer YouTube #633, 2961A Hunter Mill Rd, Oakton, VA 22124📧 Business Inquiries: Business@StephenSharer.com"
